疾病名称,疾病描述,疾病种类,科室,病因,症状,检查,并发症,花费,疗程,疗法,治愈率,易感人群,感染概率,感染途径,预防措施,推荐药物,常用药物,具体药物,可以吃,不可以吃,推荐吃,是否纳入医保
单纯性肺嗜酸粒细胞浸润症,单纯性肺嗜酸粒细胞浸润症，又名吕弗琉综合征，是吕弗琉于1932年首先描述本病。单纯性肺嗜酸粒细胞浸润症特点为游走性肺部浸润伴外周血嗜酸粒细胞计数增高，肺部症状轻微，多数仅有轻咳，病程呈自限性，常于3～4周内自行痊愈。,"疾病百科,内科,呼吸内科","内科,呼吸内科","实验证明，进食蛔虫卵后，幼虫移行至肺可发生本症典型的肺部表现和嗜酸性粒细胞升高。引起本病的其他寄生虫还有钩虫、丝虫、绦虫、姜片虫、旋毛虫和阿米巴原虫等。
药物有对氨水杨酸、阿司匹林、青霉素、硝基呋喃妥因、保泰松、氯磺丙脲、肼苯达嗪、美卡拉明(美加明)、磺胺药和甲氨蝶呤等，引起的肺泡一过性变态反应。
本病在某些地区呈季节性流行，故推测环境抗原因素在某些地区亦为可能的病因。有时吸入花粉也可发生本病。
病理变化主要位于肺间质，肺泡壁及终末细支气管壁，有不规则的嗜酸粒细胞浸润灶，有时肺泡内可见成堆的嗜酸粒细胞，极少累及血管。","嗜酸性粒细胞增多,咽部异物感,胸闷憋气,咯血伴发热,胸闷,乏力","痰液中细胞分类,胸部平片,痰液中寄生虫和虫卵",胆道蛔虫病,根据不同医院，收费标准不一致，市三甲医院约（3000 —— 8000元）,3-6周,药物治疗,100%,无特定的人群,0.005%-0.008%,无传染性,注意饮食卫生，防止感染蛔虫、钩虫、丝虫、绦虫、姜片虫、旋毛虫和阿米巴原虫等。,"注射用盐酸头孢替安,注射用磺苄西林钠,托西酸舒他西林胶囊,头孢泊肟酯胶囊,头孢氨苄甲氧苄啶片","头孢泊肟酯胶囊,头孢氨苄甲氧苄啶片","亮博(头孢泊肟酯胶囊),白云山光华头孢氨苄甲氧苄啶(头孢氨苄甲氧苄啶片),头孢氨苄甲氧苄啶片(头孢氨苄甲氧苄啶片),锋替新(注射用盐酸头孢替安),西岳制药托西酸舒他西林胶囊(托西酸舒他西林胶囊),华瑞联合制药头孢氨苄甲氧苄(头孢氨苄甲氧苄啶片),明水药业头孢氨苄甲氧苄啶片(头孢氨苄甲氧苄啶片),注射用磺苄西林钠(注射用磺苄西林钠),圣大（张家口）头孢氨苄甲氧(头孢氨苄甲氧苄啶片),大连药业托西酸舒他西林胶囊(托西酸舒他西林胶囊),瑞阳制药注射用磺苄西林钠(注射用磺苄西林钠),注射用盐酸头孢替安(注射用盐酸头孢替安),赤峰维康托西酸舒他西林胶囊(托西酸舒他西林胶囊),彼迪药业托西酸舒他西林胶囊(托西酸舒他西林胶囊),复仙安(注射用盐酸头孢替安),哈药总厂头孢氨苄甲氧苄啶片(头孢氨苄甲氧苄啶片),云门药业头孢氨苄甲氧苄啶片(头孢氨苄甲氧苄啶片),哈药总厂注射用磺苄西林钠(注射用磺苄西林钠),萨兰欣(注射用盐酸头孢替安),搏沃欣(头孢泊肟酯胶囊),哈药总厂托西酸舒他西林胶囊(托西酸舒他西林胶囊),全星制药注射用盐酸头孢替安(注射用盐酸头孢替安),罗欣药业注射用盐酸头孢替安(注射用盐酸头孢替安)",,,,否
大叶性肺炎,大叶性肺炎(lobarpneumonia)，又名肺炎球菌肺炎，是由肺炎双球菌等细菌感染引起的呈大叶性分布的急性肺实质炎症。好发于青壮年男性和冬春季节，常见诱因有受凉、淋雨、醉酒或全身麻醉手术后、镇静剂过量等，当这些诱因使呼吸道防御功能被削弱时，细菌侵入肺泡通过变态反应使肺泡壁毛细血管通透性增强，浆液及纤维素渗出，富含蛋白的渗出物中细菌迅速繁殖，并向邻近肺组织蔓延，波及一个肺段或整个肺叶。近年来由于大量强有力抗生素的使用，典型的大叶性肺炎已较少见到。临床症状有突然寒战、高热、胸痛、咳嗽、咳铁锈色痰，部分患者有恶心、呕吐及烦躁不安、谵妄等消化系统和神经系统症状。体征有急性病容，呼吸急促，鼻翼扇动，早期肺部体征不明显或仅有呼吸音减低和胸膜摩擦音;实变期可有典型体征，如患侧呼吸运动减弱，语颤增强，叩诊浊音，听诊呼吸音减低，有湿罗音或病理性支气管呼吸音。血白细胞计数及中性粒细胞增高;典型的X线表现为肺段、叶实变。该病病程短，及时应用青霉素等抗生素治疗可痊愈。,"疾病百科,内科,呼吸内科","内科,呼吸内科","多种细菌均可引起大叶性肺炎，但绝大多数为肺炎链球菌。肺炎链球菌为革兰阳性球菌，有荚膜，其致病力是由于高分子多糖体的荚膜对组织的侵袭作用。少数为肺炎杆菌、金黄色葡萄球菌、溶血性链球菌、流感嗜血杆菌等。
当机体受寒、过度疲劳、醉酒、感冒、糖尿病、免疫功能低下等使呼吸道防御功能被削弱，细菌侵入肺泡通过变态反应使肺泡壁毛细血管通透性增强，浆液及纤维素渗出，富含蛋白的渗出物中细菌迅速繁殖，并通过肺泡间孔或呼吸细支气管向邻近肺组织蔓延，波及一个肺段或整个肺叶。大叶间的蔓延系带菌的渗出液经叶支气管播散所致。
大叶肺炎病变起始于局部肺泡，并迅速蔓延至一个肺段或整个大叶。临床上起病急骤，病程大约一周。常以高热、恶寒开始，继而出现胸痛、咳嗽、咳铁锈色痰、呼吸困难、并有肺实变体征及外周血白细胞计数增高等。","湿啰音,胸痛,发烧,咳铁锈色痰,急性面容,呼吸音减弱","Optochin敏感试验,小白鼠毒力试验,痰培养,肺活量体重指数,胸部平片,免疫电泳,血常规,痰液细菌涂片检查",脓胸,根据不同医院，收费标准不一致，省市三甲医院约（3000-8000元）,7--10天,"青霉素等抗生素药物治疗,对症支持性治疗,并发症治疗",90%以上,多发生于青壮年男性,0.4%,无传染性,"1、注意预防上呼吸道感染，加强耐寒锻炼。
2、避免淋雨受寒，醉酒，过劳等诱因。
3、积极治疗原发病，如慢性心肺疾病，慢性肝炎，糖尿病和口腔疾病等，可以预防大叶性肺炎。","阿奇霉素胶囊,阿奇霉素分散片,诺氟沙星胶囊,阿奇霉素片,乳酸左氧氟沙星片","乳酸左氧氟沙星片,阿奇霉素片","宜昌长江乳酸左氧氟沙星片(乳酸左氧氟沙星片),希舒美(阿奇霉素片),维宏(阿奇霉素片),宜昌长江阿奇霉素分散片(阿奇霉素分散片),大连天宇制药阿奇霉素胶囊(阿奇霉素胶囊),兰花药业诺氟沙星胶囊(诺氟沙星胶囊),福邦药业阿奇霉素胶囊(阿奇霉素胶囊),葵花药业得菲尔公司阿奇霉素(阿奇霉素胶囊),利民制药阿奇霉素胶囊(阿奇霉素胶囊),东药阿奇霉素胶囊(阿奇霉素胶囊),浙江南洋药业阿奇霉素胶囊(阿奇霉素胶囊),江苏长江阿奇霉素胶囊(阿奇霉素胶囊),辅仁药业阿奇霉素片(阿奇霉素片),汇仁药业阿奇霉素片(阿奇霉素片),爱普森药业阿奇霉素片(阿奇霉素片),石药欧意诺氟沙星胶囊(诺氟沙星胶囊),白云山医药诺氟沙星胶囊(诺氟沙星胶囊),康美药业诺氟沙星胶囊(诺氟沙星胶囊),锦华药业诺氟沙星胶囊(诺氟沙星胶囊),北京京丰制药集团诺氟沙星胶(诺氟沙星胶囊),欣匹特(阿奇霉素分散片),海王阿奇霉素片(阿奇霉素片),安诺药业阿奇霉素分散片(阿奇霉素分散片)","栗子（熟）,鲫鱼,猪肉(瘦),油菜","洋葱,辣椒(青、尖),辣椒(红、尖、干),韭菜","奶汤锅子鱼,酱豆腐汁烧猪肉,百合汤,山楂百合汤,番茄鸡蛋煎饼,凉拌番茄,番茄猪肝瘦肉汤,番茄牛肉",否
大楼病综合征,大楼病综合征有多种表现，均因接触各种有害物质所致。好发于办公室内工作的人群，或人员密集的大楼内工作的人群。最常发生于新的密闭大楼内，这种大楼为了减少散热而不开窗，大楼内安装有加热及降温管道，这些管道由同一处发出。CO2升高是这些大楼最常见现象，是大楼病综合征的一个常见原因。患者变得焦虑，过度通气，进而发展成手足抽搐和严重的呼吸困难。,"疾病百科,其他科室,其他综合","其他科室,其他综合","高层建筑的大楼里，空气中含有危险的尘埃。这是因为吸烟或使用天然气、煤气、清洁剂、油漆、粘合剂等，不断地释放出许多种有机化学物。由于高楼人们在室内逗留时间较长，加上通风不好，就会使空气“稠化”。
它们都在向空间发射不同能量、不同频率的电磁波，由于大楼混凝土板块的作用，电磁波便像幽灵一样，在大楼里荡来荡去，这些电磁波会影响人体固有的电流和磁波，导致心律不齐和神经衰弱。
各种新型材料及室内塑料地板、壁纸、家具、涂料等装饰用品，常含有不同程度的有毒成分。这些物质可以通过人体呼吸道和皮肤的吸收，进入血液循环系统，影响机体的免疫力，从而导致病症发生。","紧张性头晕,紧张性头痛,间歇性头晕,鼻塞,头晕,恶心,眼睛痒,目赤,间歇性头痛","钼靶X线检查,CT检查,血常规",抑郁症,根据不同医院，收费标准不一致，市三甲医院约（1000——5000元）,10天,"支持性治疗,康复治疗",90%,无特定人群,0.001%,无传染性,"大楼病综合征日常预防
新楼建成后不宜立即搬入办公或居住，平时应注意利用自然通风，排出楼内污浊有毒气体，保持室内空气清新干净。建议长期在室内工作的人员每两小时起身活动一次，既能活动身体，又能清脑提神，增强心肺功能，同时要多喝水，还可在室内放一些绿色植物，既美化环境，调节空气湿度，还能避免干燥刺激皮肤和呼吸系统。
大楼病综合征健康教育
健康的室内空气质量必须由建筑师，室内设计师，大楼经营者和使用者共同来创造。大楼拥有者和公司经营者的态度尤其重要，因为员工很难从个人层面做出具体改善，所以当老板发现员工接二连三出现身体不适的情形，可别以为他们夸张了感冒病情，当有一天他们不再抱怨时，可能都已经生病在家无法继续工作了。欧洲目前的建筑概念是让摩天大楼的每个窗子都能打开，每个房间都有独立空调，每个员工都能接近一个窗子，得到充分的阳光和空气。","注射用盐酸溴己新,云南花粉片","云南花粉片,注射用盐酸溴己新","云南白药云南花粉片(云南花粉片),丰原制药注射用盐酸溴己新(注射用盐酸溴己新),普德药业注射用盐酸溴己新(注射用盐酸溴己新),海斯制药注射用盐酸溴己新(注射用盐酸溴己新),国药国瑞注射用盐酸溴己新(注射用盐酸溴己新),云南白药云南花粉片(云南花粉片),傲群(注射用盐酸溴己新),智同生物注射用盐酸溴己新(注射用盐酸溴己新),澳利达奈德注射用盐酸溴己新(注射用盐酸溴己新),一品红注射用盐酸溴己新(注射用盐酸溴己新),海鲸药业注射用盐酸溴己新(注射用盐酸溴己新),益佳清(注射用盐酸溴己新),伏枝(注射用盐酸溴己新),云南白药云南花粉片(云南花粉片),云南白药云南花粉片(云南花粉片)","圆白菜,小白菜,生菜,空心菜","洋葱,辣椒(青、尖),辣椒(红、尖、干),韭菜","生姜乌梅饮,乌梅粥,山楂乌梅饮,山楂红糖粥,山楂桑椹粥",否
二硫化碳中毒,二硫化碳(carbondisulfide，CS2)是工业上应用广泛的化学溶剂，也用于粘胶纤维、四氯化碳，农药生产等。为无色易挥发的液体，带有芳香味，工业品有烂萝卜气味。二硫化碳中毒是指因生产中发生事故而吸入二硫化碳高浓度蒸气所致中枢神经系统损害，急性中毒时轻者酒醉状态，步态不稳，感觉异常，重者可出现兴奋，谵妄，严重时发生昏迷、抽搐，甚至呼吸中枢麻痹导致死亡。,"疾病百科,急诊科",急诊科,"发病原因：
二硫化碳的工业生产：常见用二硫化碳制粘胶纤维的化纤厂拉丝车间，以及制造玻璃纸、硫氰酸盐等化工生产中。由于二硫化碳对金属、木质及橡胶等都有较强的腐蚀作用，故生产设备、管道极易受腐蚀而发生跑、冒滴、漏或突然破裂等意外事故，导致急性中毒发生。
无防护地使用二硫化碳：在用二硫化碳为羊毛去脂的羊毛加工业，用作衣服去渍剂的干洗业，以及用作熏蒸剂为粮食消毒、灭虫的种库、粮仓，也可因疏于防护，在通风不良环境中作业过久而吸入大量高浓度二硫化碳气体，引起急性中毒。
制造二硫化碳的生产过程：在用硫蒸气通入燃烧的炭火以制造二硫化碳的生产过程中，如设备简陋或防护措施不周，可因吸入大量溢出的二硫化碳浓蒸气而发生急性中毒。
二硫化碳经呼吸道进入人体，也可经皮肤和胃肠道吸收，进入体内后，10～30％仍经肺排出，70％～90％经代谢从尿排出，CS2中毒机理尚未阐明，主要有以下几种可能：
1、CS2代谢物二硫代氨基甲酸酯与维生素B6结合，致使以吡哆醛为辅酶的一些酶，如转氨酶等受抑制。
2、二硫代氨基甲酸酯与微量元素结合，如与一些脱氢酶中锌和细胞色素氧化酶，多巴胺β-羟化酶中铜结合，使酶失去活性，干扰能量及儿茶酚胺代谢，损害神经系统，特别是锥体外系。
3、CS2抑制单胺氧化酶活性，使脑中5-羟色胺积蓄，与中毒性精神病可能有关。
4、CS2抑制血浆中脂蛋白酶和脂质清除因子活性，致脂蛋白和脂类代谢紊乱，β-脂蛋白可渗入动脉壁内，导致玻璃样变，动脉硬化。","昏迷,腱反射消失,呕吐,谵妄,多发性神经炎,浅感觉减退或缺失,恶心,感觉障碍","血常规,尿常规,肾功能检查,神经系统检查,眼底荧光血管造影,肌电图,脑电图检查,心肺功能运动试验（CPET）",昏迷,根据不同病情，不同医院，收费标准不一致，市三甲医院约（1000——5000元）,1-2个月,"药物治疗,支持性治疗",80-85%,接触化学染料及粘胶纤维的工人,发病率约为0.0001%--0.0005%,无传染性,我国现用的车间空气中CS2最高容许浓度为10mg/m3，已有一些研究结果提示，这一卫生标准需要修订，以确保作业者的健康。对CS2作业者应给予就业体检和上岗后的定期查体，包括内科，神经科和眼科检查，必要时进行神经肌电图，血脂，心电图等检查。具有器质性神经系统疾病，各种精神病，视网膜病变，冠心病或糖尿病者，不宜从事CS2作业。,"布美他尼片,十一味金色丸,注射用布美他尼,注射用呋塞米,盐酸利多卡因注射液,注射用硫代硫酸钠,大月晶丸,仁青芒觉,注射用鼠神经生长因子,地塞米松磷酸钠注射液","布美他尼片,十一味金色丸","桂林南药布美他尼片(布美他尼片),雄巴拉曲神水十一味金色丸(十一味金色丸),西藏甘露仁青芒觉(仁青芒觉),金诃藏药大月晶丸(大月晶丸),金诃藏药仁青芒觉(仁青芒觉),苏肽生(注射用鼠神经生长因子),新峰药业盐酸利多卡因注射液(盐酸利多卡因注射液),海斯制药盐酸利多卡因注射液(盐酸利多卡因注射液),西藏甘露十一味金色丸(十一味金色丸),卓峰地塞米松磷酸钠注射液(地塞米松磷酸钠注射液),白云山天心地塞米松磷酸钠注(地塞米松磷酸钠注射液),涟水制药地塞米松磷酸钠注射(地塞米松磷酸钠注射液),金耀药业地塞米松磷酸钠注射(地塞米松磷酸钠注射液),遂成药业地塞米松磷酸钠注射(地塞米松磷酸钠注射液),恩经复(注射用鼠神经生长因子),金路捷(注射用鼠神经生长因子),新亚注射用硫代硫酸钠(注射用硫代硫酸钠),北京永康药业盐酸利多卡因注(盐酸利多卡因注射液),北京益民药业盐酸利多卡因注(盐酸利多卡因注射液),中国大冢盐酸利多卡因注射液(盐酸利多卡因注射液),盐酸利多卡因注射液(盐酸利多卡因注射液),全星制药注射用布美他尼(注射用布美他尼),皇隆制药注射用呋塞米(注射用呋塞米)","生菜,南瓜,苦瓜,空心菜","啤酒,白酒,洋葱,辣椒(红、尖、干)","小麦粥,荞麦粥,杂粮粥,蔬菜杂烩粥,花生杏仁粥,豆薯小米粥,羊腩萝卜丝粥,绿豆南瓜汤",否
肺-胸膜阿米巴病,肺-胸膜阿米巴病是溶组织阿米巴原虫感染所致的肺及胸膜化脓性炎症，肝原性病变多发生在右下肺，血源性则多为两肺多发病变。肠外阿米巴病中，肺和胸膜阿米巴病发生率仅次于肝脏，胸部阿米巴病右侧多发且大多继发于靠近膈肌的肝阿米巴脓肿，而肝阿米巴脓肿是肠阿米巴病的晚期并发症。,"疾病百科,内科,呼吸内科","内科,呼吸内科","发病原因：
寄生于人体的阿米巴原虫有10余种，仅溶组织阿米巴原虫对人体有致病力，滋养体是原虫的寄生形式，体内以大小滋养体和包囊形式存在，大滋养体是致病型，小滋养体是滋养体与包囊的中间过渡类型，成熟包囊具有感染性，有较强的抵抗外界能力，在粪便中存活2周以上，在水中存活5周以上，是传播疾病的惟一形态，致病性阿米巴特有的编码蛋白水解酶基因，对侵犯组织能力有重要影响。
发病机制：
阿米巴原虫感染中，90%为隐性感染，10%发生侵袭性阿米巴病。这主要取决于感染虫株的特性，也与宿主机体免疫状态，营养状况和抵抗力有关，当人吞入被包囊污染的食物或水后，因包囊有抗胃酸作用，故顺利到达小肠下段，借助于胰蛋白酶的催化作用，囊内虫体脱囊而出，分裂成小滋养体，在肠腔内定居，在结肠功能正常情况下，小滋养体停止活动，分泌囊壁形成包囊，随粪便排出，当宿主机体抵抗力下降或肠功能紊乱时，小滋养体侵入肠壁，大量增殖，转变为大滋养体，病原虫直接接触并黏附到靶细胞，吞噬，溶解组织细胞，滋养体释放水解蛋白酶引起组织溶解坏死，同时对补体有抵抗作用，黏附参与机体应答的中性粒细胞，释放更多的酶，加重组织炎症和破坏，形成脓肿。
肺，胸腹阿米巴病90%为肝源性，可由肝脓肿穿破到胸膜和肺;经肝，膈，肺粘连处组织间隙，血管侵入肺;经肝静脉入下腔静脉至肺和胸膜，肠源性则滋养体从肠壁病灶经肠道淋巴管，胸导管入上腔静脉或直肠下静脉入下腔静脉侵入肺。","盗汗,腹泻,乏力,发热伴咳嗽、咯...","胸部平片,痰液病原体检查",阿米巴肝脓肿,根据不同医院，收费标准不一致，市三甲医院约（3000——8000元）,2周--2月,"药物治疗,支持性治疗,手术治疗",80%,无特殊人群,0.01%--0.03%,无传染性,"肺-胸膜阿米巴病日常预防
本病流行于全世界，多流行于热带和亚热带地区，但较寒冷的地区，甚至北极圈内也有阿米巴感染和流行，其感染率高低与各地环境卫生，经济状况和饮食习惯等密切相关，据估计全世界约有10%的人受染，有的地方感染率可高达50%，在我国的分布一般农村高于城市，近年来由于我国卫生状况和生活水平的提高，急性阿米巴痢疾和脓肿病例，除个别地区外，已较为少见，大多为散在分布的慢性迁延型或典型病例及带虫者。
㈠传染源：
慢性病人，恢复期病人及健康的带虫者为本病的传染源，包囊抵抗力很强，在潮湿低温的环境中，可存活12天以上，在水内可活9～30天，但包囊对干燥，高温和化学药物的抵抗力较弱，如50℃时，短时即死亡，干燥环境中的生存时间仅数分钟，在0.2%盐酸，10%～20%食盐水以及酱油，醋等调味品中均不能长时间存活，50%酒精能迅速杀死之。
㈡传播途径：
溶组织内阿米巴的传播方式有以下几种：
①包囊污染水源可造成该地区的暴发流行。
②在以粪便作肥料，未洗净和未煮熟的蔬莱也是重要的传播因素。
③包囊污染手指，食物或用具而传播。
④蝇类及蟑螂都可接触粪便，体表携带和呕吐粪便，将包囊污染食物而成为重要传播媒介。
㈢流行特点：
溶组织内阿米巴病发布广泛，在温带地区，该病可时有流行，而在热带及亚热带地区，其流行情况则尤为严重，在我国解放以来，各地阿米巴的感染率明显降低，如北京首都医院1973～1978年共检查了38 075例，阳性率为0.52%;福建医大1976年惠安检查216例儿童，阳性率4.63%;东北佳木期医学院报告(1980)，检查市郊中学生487例，阳性率仅为0.4%;1979年在浙江乐清普查一个大除农民557例，阳性率为3.2%，其发病情况因时而异，以秋季为多，夏季次之，发病率男多于女，成年多于儿童，这可能与吞食含包囊的食物或年龄免疫有关。","甲硝唑片,甲硝唑维B6片,替硝唑片,奥硝唑片","甲硝唑片,替硝唑片","飞云岭药业甲硝唑片(甲硝唑片),丽珠制药替硝唑片(替硝唑片),亨瑞达制药甲硝唑片(甲硝唑片),环科药业甲硝唑片(甲硝唑片),鲁抗赛特替硝唑片(替硝唑片),皇象铁力蓝天甲硝唑维B6片(甲硝唑维B6片),迪沙药业甲硝唑维B6片(甲硝唑维B6片),彼迪药业替硝唑片(替硝唑片),潇然(奥硝唑片),傲宁(奥硝唑片),衡博来(奥硝唑片),太原药业甲硝唑片(甲硝唑片),汉森制药甲硝唑片(甲硝唑片),海力制药替硝唑片(替硝唑片),津华晖星替硝唑片(替硝唑片),东药替硝唑片(替硝唑片),迪诺制药替硝唑片(替硝唑片),沈阳一药替硝唑片(替硝唑片),甲硝唑片(甲硝唑片),亚宝药业甲硝唑片(甲硝唑片),津华晖星甲硝唑片(甲硝唑片),华中药业甲硝唑片(甲硝唑片),康美药业甲硝唑片(甲硝唑片)",,,,否
