疾病名称,疾病描述,疾病种类,科室,病因,症状,检查,并发症,花费,疗程,疗法,治愈率,易感人群,感染概率,感染途径,预防措施,推荐药物,常用药物,具体药物,可以吃,不可以吃,推荐吃,是否纳入医保
肺泡蛋白质沉积症,肺泡蛋白质沉积症(简称PAP)，又称Rosen-Castle-man-Liebow综合征，是一种罕见疾病。该病以肺泡和细支气管腔内充满PAS染色阳性，来自肺的富磷脂蛋白质物质为其特征，好发于青中年，男性发病约3倍于女性。,"疾病百科,内科,呼吸内科","内科,呼吸内科","病因未明，推测与几方面因素有关：如大量粉尘吸入（铝，二氧化硅等），机体免疫功能下降（尤其婴幼儿），遗传因素，酗酒，微生物感染等，而对于感染，有时很难确认是原发致病因素还是继发于肺泡蛋白沉着症，例如巨细胞病毒，卡氏肺孢子虫，组织胞浆菌感染等均发现有肺泡内高蛋白沉着。
虽然启动因素尚不明确，但基本上同意发病过程为脂质代谢障碍所致，即由于机体内，外因素作用引起肺泡表面活性物质的代谢异常，到目前为止，研究较多的有肺泡巨噬细胞活力，动物实验证明巨噬细胞吞噬粉尘后其活力明显下降，而病员灌洗液中的巨噬细胞内颗粒可使正常细胞活力下降，经支气管肺泡灌洗治疗后，其肺泡巨噬细胞活力可上升，而研究未发现Ⅱ型细胞生成蛋白增加，全身脂代谢也无异常，因此目前一般认为本病与清除能力下降有关。","紫绀,胸痛,呼吸困难,乏力,毓卓","胸部CT检查,肺活检,支气管镜检查",多重肺部感染,根据不同医院，收费标准不一致，省市三甲医院约（ 8000——15000 元）,约3个月,支气管肺泡灌洗,约40%,,0.00002%,无传染性,"1、避免感染分支杆菌病，卡氏肺囊肿肺炎，巨细胞病毒等。
2、注意锻炼身体，提高免疫力。",,,,,,,否
百日咳,"百日咳(pertussis，whoopingcough)是由百日咳杆菌所致的急性呼吸道传染病。其特征为阵发性痉挛性咳嗽，咳嗽末伴有特殊的鸡鸣样吸气吼声。病程较长，可达数周甚至3个月左右，故有百日咳之称。多见于5岁以下的小儿，幼婴患本病时易有窒息、肺炎，脑病等并发症，病死率高。百日咳患者，阴性感染者及带菌者为传染源。潜伏期末到病后2-3周传染性最强。百日咳经呼吸道飞沫传播。典型患者病程6-8周，临床病程可分3期：1.卡他期，从发病到开始出现咳嗽，一般1-2周。2,痉咳期，一般2-4周或更长，阵发性痉挛性咳嗽为本期特点。3，恢复期，一般1-2周，咳嗽发作的次数减少，程度减轻，不再出现阵发性痉咳。一般外周血白细胞计数明显增高，分类以淋巴细胞为主。在诊断本病时要注意与支气管异物及肺门淋巴结结核鉴别。近年来幼婴及成人发病有增多趋势。","疾病百科,儿科,小儿内科","儿科,小儿内科","(一)发病原因
病原菌是鲍特菌属(Bordetella)中的百日咳鲍特菌(B.pertussis)，常称百日咳杆菌，已知鲍特菌属有四种杆菌，除百日咳鲍特菌外还有副百日咳鲍特菌(B.parapertussis)，支气管败血鲍特菌(B.bronchiseptica)和鸟型鲍特菌(B.avium)，鸟型鲍特菌一般不引起人类致病，仅引起鸟类感染，百日咳杆菌长约1.0～1.5μm，宽约0.3～0.5μm，有荚膜，不能运动，革兰染色阴性，需氧，无芽孢，无鞭毛，用甲苯胺蓝染色两端着色较深，细菌培养需要大量(15%～25%)鲜血才能繁殖良好，故常以鲍-金(Border-Gengous)培养基(即血液，甘油，马铃薯)分离菌落，百日咳杆菌生长缓慢，在35～37℃潮湿的环境中3～7天后，一种细小的，不透明的菌落生长，初次菌落隆起而光滑，为光滑(S)型，又称I相细菌，形态高低一致，有荚膜和较强的毒力及抗原性，致病力强，如将分离菌落在普通培养基中继续培养，菌落由光滑型变为粗糙(R)型，称Ⅳ相细菌，无荚膜，毒力及抗原性丢失，并失去致病力，Ⅱ相，Ⅲ相为中间过渡型，百日咳杆菌能产生许多毒性因子，已知有五种毒素：
1、百日咳外毒素(PT)：是存在百日咳杆菌细胞壁中一种蛋白质，过去称作为白细胞或淋巴细胞增多促进因子(leukocytosis or lymphocyte promoting factor，LPE)，组胺致敏因子(histamin sensitizing factor，HSF)，胰岛素分泌活性蛋白(insulin activating protein，IAP)，百日咳外毒素由五种非共价链亚单位(S1～S5)所组成，亚单位(S2～S5)为无毒性单位，能与宿主细胞膜结合，通过具有酶活力的亚单位S1介导毒性作用，S1能通过腺苷二磷酸(ADP)-核糖转移酶的活力，催化部分ADP-核糖从烟酰胺腺嘌呤二核苷酸(NAD)中分离出来，转移至细胞膜抑制鸟苷三磷酸(CTP)结合即G蛋白合成，导致细胞变生，同时还能促使淋巴细胞增高，活化胰岛细胞及增强免疫应答。
2、耐热的内毒素(endotoxin，ET)，100℃60min只能部分破坏，180℃才能灭活，此毒素能引起机体发热及痉咳。
3、不耐热毒素(HLT)这种毒素加热55℃30min后能破坏其毒性作用，此毒素抗体对百日咳杆菌感染无保护作用。
4、气管细胞毒素(TCT)：能损害宿主呼吸道纤毛上皮细胞，使之变性，坏死。
5、腺苷环化酶毒素(ACT)：存在百日咳杆菌细胞表面的一种酶，此酶进入吞噬细胞后被调钙蛋白所激活，催化cAMP的生成，干扰吞噬作用，并抑制中性粒细胞的趋化和吞噬细胞杀菌能力，使其能持续感染，ACT也是一种溶血素，能起溶血作用，百日咳的重要抗原是百日咳菌的两种血凝活性抗原，一种为丝状血凝素(filamentous hemagglutinin，FHA)，因来自菌体表面菌毛故又称菌毛抗原，FHA在百日咳杆菌黏附于呼吸道上皮细胞的过程中起决定作用，为致病的主要原因。实验发现，FHA免疫小鼠能对抗百日咳杆菌致死性攻击，因此FHA为保护性抗原，另一种凝集原(aggluginogens，AGG)为百日咳杆菌外膜及菌毛中的一种蛋白质成分，主要含1，2，3三种血清型凝血因子，AGG-1具有种特异性；AGG-2，3具有型特异性，通过检测凝集原的型别来了解当地流行情况，目前认为这两种血凝素抗原相应抗体是保护性抗体，百日咳杆菌根据不耐热凝集原抗原性不同分为七型凝集原，1型凝集原为所有百日咳杆菌均具备，7型凝集原为鲍特菌属(包括副百日咳杆菌，支气管败血性杆菌)所共有，2～6型以不同的配合将百日咳杆菌分为不同血清型，测定血清型主要是研究流行时菌株的血清型和选择特殊血清型菌株生产菌苗，此外，副百日咳杆菌与百日咳杆菌无交叉免疫，亦可引起流行，百日咳杆菌对外界理化因素抵抗力弱，55℃经30min即被破坏，干燥数小时即可杀灭，对一般消毒剂敏感，对紫外线抵抗力弱，但在0～10℃存活较长。
(二)发病机制
1、发病机制：百日咳发病机制不甚清楚，很可能是百日咳毒素对机体综合作用的结果，当细菌随空气飞沫浸入易感者的呼吸道后，细菌的丝状血凝素黏附于咽喉至细支气管黏膜的纤毛上皮细胞表面；继之，细菌在局部繁殖并产生多种毒素如百日咳外毒素，腺苷环化酶等引起上皮细胞纤毛麻痹和细胞变性，使其蛋白合成降低，上皮细胞坏死脱落，以及全身反应，由于上皮细胞的病变发生和纤毛麻痹使小支气管中黏液及坏死上皮堆聚潴留，分泌物排出受阻，不断刺激呼吸道的周围神经，传入大脑皮质及延髓咳嗽中枢，反射性引起痉挛性咳嗽，由于长期刺激使咳嗽中枢形成兴奋灶，以致非特异性刺激，如进食，咽部检查，冷风，烟雾以及注射疼痛等，均可引起反射性的痉咳，恢复期间亦可因哭泣及其他感染，诱发百日咳样痉咳，近来研究表明百日咳发生机制与百日咳杆菌毒素类物质损害宿主细胞免疫功能有关，CD4+T细胞和Th1细胞分泌的细胞因子所介导的免疫反应，在百日咳杆菌感染中起重要作用。
2、病理解剖：百日咳杆菌侵犯鼻咽，喉，气管，支气管黏膜，可见黏膜充血，上皮细胞的基底部有多核白细胞，单核细胞浸润及部分细胞坏死。支气管及肺泡周围间质除炎症浸润外，可见上皮细胞胞质空泡形成，甚至核膜破裂溶解，坏死，脱落，但极少波及肺泡。若分泌物阻塞可引起肺不张，支气管扩张，有继发感染者，易发生支气管肺炎，有时可有间质性肺炎；若发生百日咳脑病，镜检或肉眼可见脑组织充血水肿，点状出血，皮质萎缩，神经细胞变性，脑水肿等改变，此时常可见到肝脏脂肪浸润等变化。","吸气时有蝉鸣音,痉挛性咳嗽,胸闷,肺阴虚,抽搐,低热,闫鹏辉,惊厥","耳、鼻、咽拭子细菌培养,周围血白细胞计数及分类检验,血常规,酶联免疫吸附试验,白细胞分类计数",肺不张,根据不同医院，收费标准不一致，市三甲医院约（1000-4000元）,1-2个月,"药物治疗,支持性治疗",98%,多见于小儿,0.5%,呼吸道传播,"1、控制传染源：在流行季节，若有前驱症状应及早抗生素治疗。
2、切断传播途径：由于百日咳杆菌对外界抵抗力较弱，无需消毒处理，但应保持室内通风，衣物在阳光下曝晒，对痰液及口鼻分泌物则应进行消毒处理。","琥乙红霉素片,琥乙红霉素颗粒,百咳静糖浆,穿心莲内酯片,红霉素肠溶片,环酯红霉素片","穿心莲内酯片,百咳静糖浆","惠普森穿心莲内酯片(穿心莲内酯片),北京同仁堂百咳静糖浆(百咳静糖浆),邦琪药业百咳静糖浆(百咳静糖浆),东新药业百咳静糖浆(百咳静糖浆),达发新(环酯红霉素片),康美药业红霉素肠溶片(红霉素肠溶片),旺龙药业琥乙红霉素颗粒(琥乙红霉素颗粒),白云山医药琥乙红霉素片(琥乙红霉素片),国瑞琥乙红霉素片(琥乙红霉素片),利君制药红霉素肠溶片(红霉素肠溶片),东信药业琥乙红霉素颗粒(琥乙红霉素颗粒),石药欧意红霉素肠溶片(红霉素肠溶片),平光制药红霉素肠溶片(红霉素肠溶片),北京曙光药业红霉素肠溶片(红霉素肠溶片),迪瑞制药琥乙红霉素颗粒(琥乙红霉素颗粒),永定制药百咳静糖浆(百咳静糖浆),东信药业琥乙红霉素片(琥乙红霉素片),利君制药琥乙红霉素片(琥乙红霉素片),北京中新制药琥乙红霉素片(琥乙红霉素片),华南药业红霉素肠溶片(红霉素肠溶片),佐今明百咳静糖浆(百咳静糖浆),恒益药业琥乙红霉素颗粒(琥乙红霉素颗粒),利君沙(琥乙红霉素颗粒)","南瓜子仁,圆白菜,樱桃番茄,小白菜","螃蟹,海蟹,海虾,海螺","清蒸鸡蛋羹,百合双耳鸡蛋羹,排骨汤,罗汉果雪耳鸡汤,小黄瓜凉拌面,黄瓜三丝汤,黄瓜拌兔丝,黄瓜拌皮丝",否
苯中毒,"苯(benzene)是从煤焦油分馏及石油裂解所得的一种芳香烃化合物，系无色有芳香气味的油状液体。挥发甚速，易燃易爆。工业上用作溶剂、稀释剂和化工原料。苯属中等毒类，可引起急性或慢性中毒。
急性苯中毒是指口服含苯的有机溶剂或吸入高浓度苯蒸气后，出现以中枢神经系统麻醉作用为主要表现的病理生理过程，主要症状轻者为醉酒状，步态不稳，哭笑失常，重者意识丧失，抽搐，可因呼吸中枢麻痹或循环衰竭死亡。慢性苯中毒是指苯及其代谢产物酚类影响了骨髓的造血功能，临床表现为白细胞计数和血小板立秋持续减少，最终发展为再生障碍性贫血或白血病。也可影响神经系统，表现为神经衰弱和自主神经功能紊乱。","疾病百科,急诊科",急诊科,"吸入苯蒸气或皮肤接触苯而引起的中毒，有急性、慢性之分。急性苯中毒主要对中枢神经系统产生麻醉作用，出现昏迷和肌肉抽搐；高浓度的苯对皮肤有刺激作用。长期接角低浓度的苯可引起慢性苯中毒，出现造血障碍，早期常见血白细胞数减低，进而出现血小板数减少和贫血。患者可有鼻出血、牙龈出血、皮下出血、月经过多等临床表现。
急性苯中毒多为误服或急性吸入含苯的有机溶剂所致。这些有机溶剂包括油漆、稀料、工业胶水等。慢性苯中毒是长期吸入低浓度苯及代谢产物酚类所致。","恶心,抽搐,感觉障碍","血常规,骨髓象分析,先令氏指数",贫血,根据不同病情，不同医院，收费标准不一致，市三甲医院约（5000——8000元）,根据不同病情一般为2-4周,"药物治疗,支持性治疗",75%,多见于制鞋工人及接触化工染料的工人,0.065%,无传染性,对于急性中毒患者，可以立即脱离现场至空气新鲜处，脱去污染的衣着，并用肥皂水或清水冲洗污染的皮肤。口服中毒者，要给患者洗胃，中毒者应卧床静息，并接受对症、支持治疗，可给予葡萄糖醛酸。要注意防止患者出现脑水肿，切记勿给心搏未停者使用肾上腺素，对由于苯中毒引起的再生障碍性贫血症患者，可给予小量多次输血及糖皮质激素治疗。,"布美他尼片,十一味金色丸,注射用布美他尼,注射用呋塞米,盐酸利多卡因注射液,注射用硫代硫酸钠,大月晶丸,仁青芒觉,注射用鼠神经生长因子,地塞米松磷酸钠注射液","布美他尼片,十一味金色丸","桂林南药布美他尼片(布美他尼片),雄巴拉曲神水十一味金色丸(十一味金色丸),西藏甘露仁青芒觉(仁青芒觉),金诃藏药大月晶丸(大月晶丸),金诃藏药仁青芒觉(仁青芒觉),苏肽生(注射用鼠神经生长因子),新峰药业盐酸利多卡因注射液(盐酸利多卡因注射液),海斯制药盐酸利多卡因注射液(盐酸利多卡因注射液),西藏甘露十一味金色丸(十一味金色丸),卓峰地塞米松磷酸钠注射液(地塞米松磷酸钠注射液),白云山天心地塞米松磷酸钠注(地塞米松磷酸钠注射液),涟水制药地塞米松磷酸钠注射(地塞米松磷酸钠注射液),金耀药业地塞米松磷酸钠注射(地塞米松磷酸钠注射液),遂成药业地塞米松磷酸钠注射(地塞米松磷酸钠注射液),恩经复(注射用鼠神经生长因子),金路捷(注射用鼠神经生长因子),新亚注射用硫代硫酸钠(注射用硫代硫酸钠),北京永康药业盐酸利多卡因注(盐酸利多卡因注射液),北京益民药业盐酸利多卡因注(盐酸利多卡因注射液),中国大冢盐酸利多卡因注射液(盐酸利多卡因注射液),盐酸利多卡因注射液(盐酸利多卡因注射液),全星制药注射用布美他尼(注射用布美他尼),皇隆制药注射用呋塞米(注射用呋塞米)","鸡蛋,大豆,猪肉(瘦),樱桃番茄","海蟹,海虾,海参（水浸）,辣椒(青、尖)","豆腐干炒韭菜,素炒小白菜,白菜蛋花粥",否
喘息样支气管炎,喘息样支气管炎(asthmatoidbronchitis)又称哮喘性支气管炎，泛指一组喘息表现的婴幼儿急性支气管炎，是一种过敏性质的、常与呼吸道感染有关的疾病。患者常有湿疹及其他过敏史，尤以肥胖者多发，病程较长有反复发作史。急性喘息样支气管炎的主要病理基础是支气管平滑肌痉挛、微血管渗漏、粘膜水肿、炎性细胞浸润、分泌物增多滞留所致的气道可逆性阻塞。婴幼儿的气管和支气管都比较狭小，其周围弹力纤维发育完善，故其粘膜易受感染或其他刺激而肿胀充血，引起管道狭窄，分泌物粘稠不易咳出，从而产生喘鸣音。喘息伴呼气性呼吸困难以夜间为重，可有刺激性咳嗽。喘息可自行缓解或经治疗后缓解，发作间隙可无任何症状和体征，部分可发展为支气管哮喘。,"疾病百科,内科,呼吸内科","内科,呼吸内科","因为多种病毒和细菌感染均可引起，较常见的有合胞病毒、副流感病毒、流感病毒、腺病毒、鼻病毒及肺炎支原体等，大多数病例可在病毒感染基础上并发细菌感染。
婴幼儿的气管和支气管都比较狭小，其周围弹力纤维发育完善，故其粘膜易受感染或其他刺激而肿胀充血，引起管道狭窄，分泌物粘稠不易咳出，从而产生喘鸣音。
因为婴幼儿患病毒感染者甚多，仅一小部分患儿呈喘息样支气管炎表现，提示同一病毒在不同个别中所产生的不同病理生理改变和临床表现，与机体内在因素密切相关。如近年发现合胞病毒引起的喘息样支气管炎患儿出现特异性IgE抗体，其鼻咽分泌物中组织胺浓度明显高于同样感染而无喘息表现的患儿，其亲属往往有过敏性鼻炎、荨麻疹、哮喘等变态反应性疾病史。约30%左右的患儿曾患湿疹，测血清SIgE含量常见增高。","耸肩喘息,哮鸣音,纤毛上皮细胞损伤脱落,变应性咳嗽,化学性支气管炎,喘息,冬春季的慢性咳...,咳嗽伴哮鸣音","肺部检查,肺和胸膜听诊,抗链球菌型M蛋白抗体,抗链球菌壁多糖抗体,酶联免疫吸附试验",支气管哮喘,根据不同医院，收费标准不一致，市三甲医院约（5000——8000元）,6-12个月,"药物治疗,支持性治疗",95%,无特定的人群,3-5%,无传染性,根据上节所述，对喘息样支气管炎病儿，要注意家族与患儿自身过敏史，嗜酸性粒细胞检查，血清IgE水平等进行分析。如有支气管哮喘可疑时，应及早给予哮喘的防治措施。,"枸橼酸喷托维林片,氨茶碱片,二羟丙茶碱片,胸腺肽肠溶片,硫酸沙丁胺醇气雾剂,小青龙合剂,硫酸沙丁胺醇片,蛇胆川贝液,小青龙颗粒,布地奈德气雾剂,喷托维林氯化铵糖浆","布地奈德气雾剂,喷托维林氯化铵糖浆","信谊布地奈德气雾剂(布地奈德气雾剂),桑海制药喷托维林氯化铵糖浆(喷托维林氯化铵糖浆),赣南制药喷托维林氯化铵糖浆(喷托维林氯化铵糖浆),奇莫欣(胸腺肽肠溶片),振兴氨茶碱片(氨茶碱片),盛翔制药蛇胆川贝液(蛇胆川贝液),蛇胆川贝液(蛇胆川贝液),晶珠藏药蛇胆川贝液(蛇胆川贝液),天天乐药业蛇胆川贝液(蛇胆川贝液),东信药业蛇胆川贝液(蛇胆川贝液),广西灵峰药业蛇胆川贝液(蛇胆川贝液),吉林东方制药枸橼酸喷托维林(枸橼酸喷托维林片),万托林(硫酸沙丁胺醇气雾剂),天津太平洋二羟丙茶碱片(二羟丙茶碱片),海南制药厂蛇胆川贝液(蛇胆川贝液),首儿药厂小青龙颗粒(小青龙颗粒),石药欧意枸橼酸喷托维林片(枸橼酸喷托维林片),纽兰药业小青龙颗粒(小青龙颗粒),纽兰药业小青龙合剂(小青龙合剂),济安堂蛇胆川贝液(蛇胆川贝液),迪龙制药胸腺肽肠溶片(胸腺肽肠溶片),天津力生制药硫酸沙丁胺醇片(硫酸沙丁胺醇片),仁和堂硫酸沙丁胺醇片(硫酸沙丁胺醇片)","鸡蛋,海蚌,赤贝,圆白菜","海蟹,海虾,海螺,猪肉(肥瘦)","紫苏粥,菊花芦根茶,生芦根粥,鲜芦根粥,薏仁党参粥,党参粥,黄芪粥,鸡蛋木耳粥",否
